<?xml version="1.0" encoding="UTF-8"?>
<!-- version 1.01 Edit by 2009-09-22 -->

<schema xmlns="http://www.w3.org/2001/XMLSchema" xmlns:pbl="http://www.pbcls.org/pbco/"
	targetNamespace="http://www.pbcls.org/pbco/">
	
	<!-- Element Definitions -->

	<element name="description" type="string"></element>

	<element name="version" type="string"></element>

	<element name="author" type="string"></element>

	<element name="email" type="string"></element>

	<element name="creationdate" type="date"></element>

	<element name="lastmodified" type="date"></element>

	<element name="id" type="string"></element>
	
	<element name="name" type="string"></element>

	<element name="role" type="string"></element>

	<element name="resource" type="pbl:resourceType"></element>

	<element name="resources" type="pbl:resourcesType"></element>

	<element name="duration" type="string"></element>
	
	<element name="isparent" type="boolean"></element>
	
	<element name="ismilestone" type="boolean"></element>

	<element name="parentid" type="string"></element>

	<element name="resourceids" type="string"></element>

	<element name="inputs" type="pbl:inputsType"></element>
	
	<element name="file" type="string"></element>

	<element name="outputs" type="pbl:outputsType"></element>

	<element name="predecessorids" type="string"></element>

	<element name="task" type="pbl:taskType"></element>
	
	<element name="wbs" type="string"></element>

	<element name="tasks" type="pbl:tasksType"></element>

	<element name="pbco" type="pbl:pbcoType"></element>

	<!-- ComplexType Definitions -->
	
	<complexType name="inputsType">
		<sequence>
			<element ref="pbl:file" maxOccurs="unbounded"></element>
		</sequence>
	</complexType>
	
	<complexType name="outputsType">
		<sequence>
			<element ref="pbl:file" maxOccurs="unbounded"></element>
		</sequence>
	</complexType>

	<complexType name="resourceType">
		<all>
			<element ref="pbl:id"></element>
			<element ref="pbl:name"></element>
			<element ref="pbl:description" minOccurs="0"></element>
			<element ref="pbl:role"></element>
		</all>
	</complexType>

	<complexType name="resourcesType">
		<sequence>
			<element ref="pbl:resource" maxOccurs="unbounded" minOccurs="1"></element>
		</sequence>
	</complexType>

	<complexType name="taskType">
		<all>
			<element ref="pbl:id"></element>
			<element ref="pbl:name"></element>
			<element ref="pbl:wbs" minOccurs="0"></element>
			<element ref="pbl:description" minOccurs="0"></element>
			<element ref="pbl:isparent" minOccurs="0"></element>
			<element ref="pbl:resourceids" minOccurs="0"></element>
			<element ref="pbl:duration" minOccurs="0"></element>
			<element ref="pbl:ismilestone" minOccurs="0"></element>		
			<element ref="pbl:parentid" minOccurs="0"></element>					
			<element ref="pbl:inputs" minOccurs="0"></element>
			<element ref="pbl:outputs" minOccurs="0"></element>
			<element ref="pbl:predecessorids" minOccurs="0"></element>
		</all>
	</complexType>

	<complexType name="tasksType">
		<sequence>
			<element ref="pbl:task" maxOccurs="unbounded" minOccurs="1"></element>
		</sequence>
	</complexType>

	<complexType name="pbcoType">
		<all>
			<element ref="pbl:name"></element>
			<element ref="pbl:description" minOccurs="0"></element>
			<element ref="pbl:version" minOccurs="0"></element>			
			<element ref="pbl:author" minOccurs="0"></element>
			<element ref="pbl:email" minOccurs="0"></element>
			<element ref="pbl:creationdate" minOccurs="0"></element>
			<element ref="pbl:lastmodified" minOccurs="0"></element>
			<element ref="pbl:resources" minOccurs="0"></element>
			<element ref="pbl:tasks"></element>
		</all>
	</complexType>
</schema>