<?xml version="1.0" encoding="utf-8"?>
<pbco xmlns:xsi="http://www.w3.org/2001/XMLSchema-instance" xsi:schemaLocation="http://www.pbcls.org/pbco/ pbco.xsd" xmlns="http://www.pbcls.org/pbco/">
	<!-- 案例的基本属性 -->
	<name>ADS_Project_2 Population</name>
	<description></description>
	<version>1.0</version>
	<author>PBCLS</author>
	<email>PBCLS@zju.edu.name</email>
	<creationdate>2010-03-02</creationdate>
	
	<!-- 案例的资源 -->
	<resources>
		<resource>
			<id>1</id>
			<name>Programmer</name>
			<description></description>
			<role>PM</role>
		</resource>	
		<resource>
			<id>2</id>
			<name>Tester</name>
			<description></description>
			<role>Member</role>
		</resource>
		<resource>
			<id>3</id>
			<name>Writer</name>
			<description></description>
			<role>Member</role>
		</resource>
	</resources>	
	
	<!-- 案例任务 -->
	<tasks>
		<task>
			<id>1</id>
			<name>Programming</name>
			<wbs>1</wbs>
			<description>Write the program (10 pts.) with sufficient comments.</description>
			<isparent>0</isparent>
			<resourceids>1</resourceids>
			<duration>7</duration>
			<inputs>
				<file>P2.doc</file>	
			</inputs>
			<outputs>
				<file>Source.zip</file>	
			</outputs>
		</task>	
		<task>
			<id>2</id>
			<name>Testing</name>
			<wbs>2</wbs>
			<description>)Provide a set of test cases to fill in a test report (3 pts.).  Write analysis and comments (3 pts.).</description>
			<isparent>0</isparent>
			<resourceids>2</resourceids>
			<duration>7</duration>
			<inputs>
				<file>P2.doc</file>	
			</inputs>
			<outputs>
				<file>Test.zip</file>	
			</outputs>
		</task>					
		<task>
			<id>3</id>
			<name>Documentation Writing</name>
			<wbs>3</wbs>
			<description>Chapter 1 (1 pt.), Chapter 2 (2 pts.), and finally a complete report (1 point for overall style of documentation).</description>
			<isparent>0</isparent>
			<resourceids>3</resourceids>
			<duration>5</duration>
			<predecessorids>1,2</predecessorids>
			<inputs>
				<file>Requirements.doc</file>	
			</inputs>
			<outputs>
				<file>Report.doc</file>	
			</outputs>
		</task>			
		<task>
			<id>4</id>
			<name>Make presentation</name>
			<wbs>4</wbs>
			<description></description>
			<isparent>0</isparent>
			<resourceids>3</resourceids>
			<duration>2</duration>
			<predecessorids>3</predecessorids>
			<inputs>
				<file></file>	
			</inputs>
			<outputs>
				<file>Project.ppt</file>	
			</outputs>
		</task>		
		
					
  </tasks>
	
</pbco>
