<?xml version="1.0" encoding="utf-8"?>
<pbco xmlns:xsi="http://www.w3.org/2001/XMLSchema-instance" xsi:schemaLocation="http://www.pbcls.org/pbco/ pbco.xsd" xmlns="http://www.pbcls.org/pbco/">
	<!-- 案例的基本属性 -->
	<name>DS_Project_3_Hashing</name>
	<description></description>
	<version>1.0</version>
	<author>PBCLS</author>
	<email>PBCLS@zju.edu.name</email>
	<creationdate>2010-03-02</creationdate>
	
	<!-- 案例的资源 -->
	<resources>
		<resource>
			<id>1</id>
			<name>Programmer</name>
			<description></description>
			<role>PM</role>
		</resource>	
		<resource>
			<id>2</id>
			<name>Tester</name>
			<description></description>
			<role>Member</role>
		</resource>
		<resource>
			<id>3</id>
			<name>Writer</name>
			<description></description>
			<role>Member</role>
		</resource>
	</resources>	
	
	<!-- 案例任务 -->
	<tasks>
		<task>
			<id>1</id>
			<name>Programming</name>
			<wbs>1</wbs>
			<description>Write the program (50 pts.) with sufficient comments.</description>
			<isparent>0</isparent>
			<resourceids>1</resourceids>
			<duration>9</duration>
			<inputs>
				<file>P3.pdf</file>	
			</inputs>
			<outputs>
				<file>solution.cpp</file>	
			</outputs>
		</task>	
		<task>
			<id>2</id>
			<name>Testing</name>
			<wbs>2</wbs>
			<description>Provide a set of test cases to fill in a test report (20 pts.).  Note that the tester is responsible, as well as the programmer is, for any bug later found by Judge.  Write analysis and comments (10 pts.).</description>
			<isparent>0</isparent>
			<resourceids>2</resourceids>
			<duration>9</duration>
			<inputs>
				<file>P3.pdf</file>	
			</inputs>
			<outputs>
				<file>testcases.txt</file>	
			</outputs>
		</task>					
		<task>
			<id>3</id>
			<name>Report Writing</name>
			<wbs>3</wbs>
			<description>Write Chapter 1 (6 pts.), Chapter 2 (12 pts.), and finally a complete report (2 pts. for overall style of documentation).</description>
			<isparent>0</isparent>
			<resourceids>3</resourceids>
			<predecessorids>1,2</predecessorids>
			<duration>5</duration>
			<inputs>
				<file>Requirements.doc</file>	
			</inputs>
			<outputs>
				<file>report.pdf</file>	
			</outputs>
		</task>			
			
  </tasks>
	
</pbco>
